short_code,name,researcher,affiliation,language_family,language_claimed,script_type,status,is_null_hypothesis,publication,publication_year,version,description
VPS2024,Proto-Tamil Hypothesis (VPS 2024),V.P. Selvakumar,Independent,Dravidian,Old Tamil,syllabic,active,0,Ancient Harappans Speak! After 5000 years (2024); Indus Script is a Language (2026),2024,3.0,Maps Indus graphemes to Tamil phonemes/morphemes. Tally marks as phonetic placeholders. Urban topology hypothesis for motifs.
PARPOLA,Proto-Dravidian Hypothesis (Parpola),Asko Parpola,University of Helsinki,Dravidian,Proto-Dravidian,logo-syllabic,active,0,"Deciphering the Indus Script. Cambridge University Press, 1994.",1994,1.0,Rebus principle mapping to Proto-Dravidian. Most widely accepted academic framework.
MAHADEVAN,Dravidian Hypothesis (Mahadevan),Iravatham Mahadevan,RMRL Chennai,Dravidian,Proto-Dravidian,logo-syllabic,active,0,"The Indus Script: Texts, Concordance and Tables. ASI, 1977.",1977,1.0,Foundational corpus concordance. Sign numbering standard still in use.
FSW2004,Non-Linguistic Emblem Thesis (Farmer-Sproat-Witzel),"Steve Farmer, Richard Sproat, Michael Witzel",UPenn / U of Illinois / Harvard,N/A,None,non-linguistic emblems,active,1,"The Collapse of the Indus Script Thesis. EJVS, 2004.",2004,1.0,"Signs are political/religious emblems, not phonetic. High singleton rate as evidence. Primary null hypothesis."
RAO2009,Dravidian Statistical (Rao et al.),Rajesh Rao et al.,University of Washington,Dravidian (inferred),Unknown,structured language-like,active,0,"Entropic Evidence for Linguistic Structure in the Indus Script. Science, 2009.",2009,1.0,Entropy/n-gram analysis shows Indus signs have linguistic structure. Does not claim specific language.
RAJARAM,Proto-Sanskrit Hypothesis (Rajaram-Jha),"N.S. Rajaram, N. Jha",Independent,Indo-Aryan,Vedic Sanskrit,syllabic,archived,0,"The Deciphered Indus Script. Aditya Prakashan, 1996.",1996,1.0,Claims script encodes Sanskrit. Largely discredited after horse-seal fabrication controversy (2000).
